{
  "inventoryVersion": 1,
  "auditStatus": "incomplete",
  "scope": "declared direct dependencies in repository Cargo and npm manifests",
  "generatedAt": "2026-10-03",
  "resolvedDependencyClosureIncluded": false,
  "releaseGate": "Resolve all Rust and npm dependency graphs for each supported target, verify every SPDX expression and distribution obligation, then regenerate this inventory and include the required notices.",
  "dependencies": [
    {
      "name": "age",
      "ecosystem": "cargo",
      "declaredVersion": "0.12.1",
      "licenseExpression": "MIT OR Apache-2.0",
      "verificationStatus": "verified-upstream",
      "source": "https://github.com/str4d/rage",
      "notes": "Rust library implementing the interoperable age format. The 0.x crate is marked experimental/beta upstream; Arcade Box currently enables ASCII armor and passphrase (scrypt) workflows only. Reassess before release and audit the resolved dependency closure."
    },
    {
      "name": "ashpd",
      "ecosystem": "cargo",
      "declaredVersion": "0.13.13",
      "licenseExpression": "MIT",
      "verificationStatus": "pending",
      "source": "https://github.com/bilelmoussaoui/ashpd",
      "notes": "Declared crate metadata; upstream license text not yet reviewed."
    },
    {
      "name": "base64",
      "ecosystem": "cargo",
      "declaredVersion": "0.23",
      "licenseExpression": "MIT OR Apache-2.0",
      "verificationStatus": "verified-upstream",
      "source": "https://github.com/marshallpierce/rust-base64",
      "notes": "RFC 4648 base64 encoding and decoding for local data utilities."
    },
    {
      "name": "blake3",
      "ecosystem": "cargo",
      "declaredVersion": "1.8",
      "licenseExpression": null,
      "verificationStatus": "pending",
      "source": "https://github.com/BLAKE3-team/BLAKE3",
      "notes": "Verify resolved package metadata and source notice."
    },
    {
      "name": "calamine",
      "ecosystem": "cargo",
      "declaredVersion": "0.36.1",
      "licenseExpression": "MIT",
      "verificationStatus": "pending",
      "source": "https://github.com/tafia/calamine",
      "notes": "Declared crate metadata; upstream license text not yet reviewed."
    },
    {
      "name": "cap-std",
      "ecosystem": "cargo",
      "declaredVersion": "4.0.3",
      "licenseExpression": "Apache-2.0 WITH LLVM-exception OR Apache-2.0 OR MIT",
      "verificationStatus": "verified-upstream",
      "source": "https://github.com/bytecodealliance/cap-std",
      "notes": "Capability-based filesystem API used for scoped output-directory writes; this direct package uses a permissive OR license expression."
    },
    {
      "name": "chrono",
      "ecosystem": "cargo",
      "declaredVersion": "0.4",
      "licenseExpression": "MIT OR Apache-2.0",
      "verificationStatus": "verified-upstream",
      "source": "https://github.com/chronotope/chrono",
      "notes": "Local date/time parsing and conversion; clock support enabled."
    },
    {
      "name": "chrono-tz",
      "ecosystem": "cargo",
      "declaredVersion": "0.10",
      "licenseExpression": "MIT OR Apache-2.0",
      "verificationStatus": "verified-upstream",
      "source": "https://github.com/chronotope/chrono-tz",
      "notes": "Bundled IANA time-zone rules for offline time-zone conversion and DST-aware scheduling."
    },
    {
      "name": "clap",
      "ecosystem": "cargo",
      "declaredVersion": "4.5",
      "licenseExpression": null,
      "verificationStatus": "pending",
      "source": "https://github.com/clap-rs/clap",
      "notes": "Feature-selected transitive dependencies are outside this direct-dependency snapshot."
    },
    {
      "name": "csv",
      "ecosystem": "cargo",
      "declaredVersion": "1.4",
      "licenseExpression": "Unlicense OR MIT",
      "verificationStatus": "verified-upstream",
      "source": "https://github.com/BurntSushi/rust-csv",
      "notes": "CSV parser and writer for the local workbench."
    },
    {
      "name": "data-encoding",
      "ecosystem": "cargo",
      "declaredVersion": "2.11",
      "licenseExpression": "MIT",
      "verificationStatus": "verified-upstream",
      "source": "https://github.com/ia0/data-encoding",
      "notes": "Base32 encoding and decoding for local data utilities."
    },
    {
      "name": "directories",
      "ecosystem": "cargo",
      "declaredVersion": "6.0",
      "licenseExpression": null,
      "verificationStatus": "pending",
      "source": "https://crates.io/crates/directories",
      "notes": "Verify resolved package metadata and source notice."
    },
    {
      "name": "emojis",
      "ecosystem": "cargo",
      "declaredVersion": "0.9.0",
      "licenseExpression": "(MIT OR Apache-2.0) AND Unicode-3.0",
      "verificationStatus": "pending",
      "source": "https://github.com/rossmacarthur/emojis",
      "notes": "Declared crate metadata; upstream license text not yet reviewed."
    },
    {
      "name": "futures-channel",
      "ecosystem": "cargo",
      "declaredVersion": "0.3",
      "licenseExpression": "MIT OR Apache-2.0",
      "verificationStatus": "pending",
      "source": "https://github.com/rust-lang/futures-rs",
      "notes": "Declared crate metadata; upstream license text not yet reviewed."
    },
    {
      "name": "futures-util",
      "ecosystem": "cargo",
      "declaredVersion": "0.3",
      "licenseExpression": "MIT OR Apache-2.0",
      "verificationStatus": "pending",
      "source": "https://github.com/rust-lang/futures-rs",
      "notes": "Declared crate metadata; upstream license text not yet reviewed."
    },
    {
      "name": "gtk",
      "ecosystem": "cargo",
      "declaredVersion": "0.18",
      "licenseExpression": "MIT",
      "verificationStatus": "pending",
      "source": "https://github.com/gtk-rs/gtk3-rs",
      "notes": "Declared crate metadata; upstream license text not yet reviewed."
    },
    {
      "name": "image",
      "ecosystem": "cargo",
      "declaredVersion": "0.25",
      "licenseExpression": "MIT OR Apache-2.0",
      "verificationStatus": "verified-upstream",
      "source": "https://github.com/image-rs/image",
      "notes": "Narrow image codec feature set supports barcode image conversion; transitive codec licenses still need closure audit."
    },
    {
      "name": "infer",
      "ecosystem": "cargo",
      "declaredVersion": "0.22",
      "licenseExpression": "MIT",
      "verificationStatus": "pending",
      "source": "https://github.com/bojand/infer",
      "notes": "Declared crate metadata; upstream license text not yet reviewed."
    },
    {
      "name": "libc",
      "ecosystem": "cargo",
      "declaredVersion": "0.2",
      "licenseExpression": "MIT OR Apache-2.0",
      "verificationStatus": "pending",
      "source": "https://github.com/rust-lang/libc",
      "notes": "Declared crate metadata; upstream license text not yet reviewed."
    },
    {
      "name": "lopdf",
      "ecosystem": "cargo",
      "declaredVersion": "0.44",
      "licenseExpression": "MIT",
      "verificationStatus": "pending",
      "source": "https://github.com/J-F-Liu/lopdf",
      "notes": "Declared crate metadata; upstream license text not yet reviewed."
    },
    {
      "name": "printpdf",
      "ecosystem": "cargo",
      "declaredVersion": "0.12.8",
      "licenseExpression": "MIT",
      "verificationStatus": "pending",
      "source": "https://github.com/fschutt/printpdf",
      "notes": "Declared crate metadata; upstream license text not yet reviewed."
    },
    {
      "name": "pulldown-cmark",
      "ecosystem": "cargo",
      "declaredVersion": "0.13",
      "licenseExpression": "MIT",
      "verificationStatus": "verified-upstream",
      "source": "https://github.com/raphlinus/pulldown-cmark",
      "notes": "CommonMark parser for local HTML preview generation; raw HTML and unsafe links are removed before rendering."
    },
    {
      "name": "quick-xml",
      "ecosystem": "cargo",
      "declaredVersion": "0.42",
      "licenseExpression": "MIT",
      "verificationStatus": "pending",
      "source": "https://github.com/tafia/quick-xml",
      "notes": "Declared crate metadata; upstream license text not yet reviewed."
    },
    {
      "name": "rand",
      "ecosystem": "cargo",
      "declaredVersion": "0.9",
      "licenseExpression": "MIT OR Apache-2.0",
      "verificationStatus": "verified-upstream",
      "source": "https://github.com/rust-random/rand",
      "notes": "Non-cryptographic line shuffling for the text workbench; password tools must use a dedicated cryptographic RNG."
    },
    {
      "name": "regex",
      "ecosystem": "cargo",
      "declaredVersion": "1.13",
      "licenseExpression": "MIT OR Apache-2.0",
      "verificationStatus": "verified-upstream",
      "source": "https://github.com/rust-lang/regex",
      "notes": "Linear-time regular expression engine used by the local regex playground."
    },
    {
      "name": "roxmltree",
      "ecosystem": "cargo",
      "declaredVersion": "0.21",
      "licenseExpression": "MIT OR Apache-2.0",
      "verificationStatus": "pending",
      "source": "https://github.com/RazrFalcon/roxmltree",
      "notes": "Declared crate metadata; upstream license text not yet reviewed."
    },
    {
      "name": "rusqlite",
      "ecosystem": "cargo",
      "declaredVersion": "0.40",
      "licenseExpression": null,
      "verificationStatus": "pending",
      "source": "https://github.com/rusqlite/rusqlite",
      "notes": "The bundled SQLite feature and the SQLite amalgamation require separate distribution review."
    },
    {
      "name": "rust_xlsxwriter",
      "ecosystem": "cargo",
      "declaredVersion": "0.99.1",
      "licenseExpression": "MIT OR Apache-2.0",
      "verificationStatus": "pending",
      "source": "https://github.com/jmcnamara/rust_xlsxwriter",
      "notes": "Declared crate metadata; upstream license text not yet reviewed."
    },
    {
      "name": "screencapturekit",